<?xml version="1.0" encoding="UTF-8"?>
<!DOCTYPE predicate SYSTEM "predicate.dtd">
<predicate type="WCP">
	<CGSs>
		<CGS name = "m" value = "conjunction">
			<LP>
				<formula>
	 				<atom operator="great-than" name="light_1" value="500" />
				</formula>
      		</LP>
      		<LP>
				<formula>
	  				<atom operator="not-contain" name="RFID_1" value="tag_00001" />
				</formula>
      		</LP>
		</CGS>
	</CGSs>
	<specification>
		<prefix value="pos" />
		<GSE value="conjunction">
			<element>
				<cgs name = "m"/>
			</element>
			<global>g</global>
		</GSE>
	</specification>
</predicate>
