<?xml version="1.0" encoding="UTF-8"?>
<!DOCTYPE predicate SYSTEM "predicate.dtd" >
<predicate type="CTL">
  <CGSs>
	<CGS name="d" value="conjunction">
		<LP>
			<formula>
				<atom operator="less-than" name="light" value="500" />
			</formula>
		</LP>
<!-- 		<LP> -->
<!-- 			<formula> -->
<!-- 				<atom operator="contain" name="RFID_1" value="tag_00001" /> -->
<!-- 			</formula> -->
<!-- 		</LP> -->
	</CGS>
	<CGS name="e" value="conjunction">
<!-- 		<LP> -->
<!-- 			<formula> -->
<!-- 				<atom operator="greater-than" name="light_1" value="500" /> -->
<!-- 			</formula> -->
<!-- 		</LP> -->
		<LP>
			<formula>
				<atom operator="contain" name="RFID" value="tag_00001" />
			</formula>
		</LP>
	</CGS>
  </CGSs>
  
  	<specification>
  		<CTLFormula>
     		<CTLFormula>
       			<cgs name="d"/>
     		</CTLFormula>
     		<binary value="EU" />
     		<CTLFormula>
     			<cgs name="e"/>
     		</CTLFormula>
   		</CTLFormula>
	</specification>
</predicate>


