<?xml version="1.0" encoding="UTF-8"?>
<!DOCTYPE predicate SYSTEM "predicate.dtd">
<predicate type="WCP">
	<prefix value="def" />
	<GSE value="conjunction">
		<CGS value="conjunction">
			<LP>
				<formula>
					<atom operator="great-than" name="temperature" value="27" />
				</formula>
			</LP>
			<LP>
				<formula>
					<atom operator="not-contain" name="RFID" value="tag_00001" />
				</formula>
			</LP>
			<LP>
				<formula>
					<formula>
						<quantifier value="universal"/>
						<formula>
							<atom operator="great-than" name="temperature" value="25" />
						</formula>
					</formula>
					<binary value="conjunction"/>
					<formula>
						<unary value="not"/>
						<formula>
							<atom operator="great-than" name="temperature" value="27" />
						</formula>
					</formula>
				</formula>
			</LP>
		</CGS>
		<global>g</global>
	</GSE>
</predicate>
