<?xml version="1.0" encoding="UTF-8"?>
<!DOCTYPE predicate SYSTEM "predicate.dtd">
<predicate type="SCP">
	<CGSs>
		<CGS name = "b" value = "conjunction">
			<LP><atom operator="great-than" name="light" value="500" /></LP>
			<LP><atom operator="not-contain" name="RFID" value="tag_00001" /></LP>
		</CGS>
	</CGSs>
	<specification>
		<prefix value="def" />
		<GSE value="conjunction">
			<element><cgs name = "b"/></element>
			<global>g</global>
		</GSE>
	</specification>
</predicate>
