<?xml version="1.0" encoding="UTF-8"?>
<!DOCTYPE predicate SYSTEM "predicate.dtd">
<predicate type="WINDOWSEQUENCE">
	<CGSs>
		<CGS name="a" value="conjunction">
			<LP windowSize="2">
				<formula>
					<atom operator="great-than" name="light" value="500" />
				</formula>
			</LP>
			<LP windowSize="2">
				<formula>
					<atom operator="contain" name="RFID" value="tag_00001" />
				</formula>
			</LP>
			<!-- <LP windowSize="2">
				<formula>
					<atom operator="less-than" name="light_1" value="500" />
				</formula>
			</LP>
			<LP windowSize="2">
				<formula>
					<atom operator="not-contain" name="RFID_1" value="tag_00001" />
				</formula>
			</LP>
			<LP windowSize="2">
				<formula>
					<atom operator="great-than" name="light_2" value="500" />
				</formula>
			</LP>
			<LP windowSize="2">
				<formula>
					<atom operator="contain" name="RFID_2" value="tag_00001" />
				</formula>
			</LP>
			<LP windowSize="2">
				<formula>
					<atom operator="less-than" name="light_3" value="500" />
				</formula>
			</LP>
			<LP windowSize="2">
				<formula>
					<atom operator="not-contain" name="RFID_3" value="tag_00001" />
				</formula>
			</LP>
			<LP windowSize="2">
				<formula>
					<atom operator="great-than" name="light_4" value="500" />
				</formula>
			</LP> -->
		</CGS>
	</CGSs>
	<specification>
		<prefix value="def" />
		<GSE value="conjunction">
			<element>
				<oneOrMore>
					<element>
						<cgs name="a" />
					</element>
				</oneOrMore>
			</element>
			<!--<element>
				<cgs name="b" />
			</element>
			<element>
				<cgs name="c" />
			</element>
			--><global>g</global>
		</GSE>
	</specification>
</predicate>
