<?xml version="1.0" encoding="UTF-8"?>
<!DOCTYPE predicate SYSTEM "../predicate.dtd" >
<predicate type="CTL">
  <CGSs>
	<CGS name="a" value="conjunction">
		<LP>
			<formula>
				<atom operator="great-than" name="light" value="500" />
			</formula>
		</LP>
		<LP>
			<formula>
				<atom operator="contain" name="RFID" value="tag_00001" />
			</formula>
		</LP>
	</CGS>
	<CGS name="b" value="conjunction">
		<LP>
			<formula>
				<atom operator="less-than" name="light_1" value="500" />
			</formula>
		</LP>
		<LP>
			<formula>
				<atom operator="contain" name="RFID_1" value="tag_00001" />
			</formula>
		</LP>
	</CGS>
  </CGSs>
  
  	<specification>
  		<CTLFormula>
     		<CTLFormula>
     			<unary value="not" />
     			<CTLFormula>
     				<cgs name="a"/>
     			</CTLFormula>
     		</CTLFormula>
     		<binary value="AU" />
     		<CTLFormula>
     			<cgs name="b"/>
     		</CTLFormula>
   		</CTLFormula>
	</specification>
</predicate>