<?xml version="1.0" encoding="UTF-8"?>
<!DOCTYPE predicate SYSTEM "predicate.dtd">
<predicate type="WCP">
  <prefix value="def" />
  <GSE value="conjunction">
    <CGS value="conjunction">
      <LP>
	<formula>
	  <atom operator="great-than" name="temperature" value="27" />
	</formula>
      </LP>
      <LP>
	<formula>
	  <atom operator="contain" name="RFID" value="tag_00001" />
	</formula>
      </LP>
      <LP>
	<formula>
	  <atom operator="less-than" name="temperature_1" value="27" />
	</formula>
      </LP>
      <LP>
	<formula>
	  <atom operator="not-contain" name="RFID_1" value="tag_00001" />
	</formula>
      </LP>
    </CGS>
    <global>g</global>
  </GSE>
</predicate>
