<?xml version="1.0" encoding="UTF-8"?>
<!DOCTYPE predicate SYSTEM "predicate.dtd">
<predicate type="SURSEQUENCE">
	<CGSs>
		<CGS name="e" value="conjunction">
			<LP><formula><atom operator="great-than" name="light" value="500" /></formula></LP>
		</CGS>
		<CGS name="f" value="conjunction">
			<LP><formula><atom operator="less-than" name="light_1" value="500" /></formula></LP>
		</CGS>
	</CGSs>
	<specification>
		<prefix value="pos" />
		<GSE value="conjunction">
			<element><oneOrMore><element><cgs name="e"/></element></oneOrMore></element>
			<element><cgs name="f"/></element>
			<global>g</global>
  		</GSE>
	</specification>
</predicate>
